Percentage of Trips by Walking,This indicator measure the percentage of commuting trips made walking out of all means of transportation for workers age 16 and older.,"Imagine Austin calls for investment in compact and connected development, including bicycle and pedestrian infrastructure, and greater use of that infrastructure through alternative forms of transportation.",2.1,2.01,2.38,3.19,2.98,2.99,2.57,2.71,2.54,2.03,,percent
Percent of Population that Performs the Recommended Amount of  Physical Activity,This indicator measures the percent of Travis County adults that participate in at least 150 minutes of moderate to vigorous physical activity per week.,"Exercise is part of the Healthy Austin program. Investing in accessible walking and biking networks and open space will provide residents increased opportunities for outdoor exercise as part of their daily routines.

Increasing the percentage of Travis County adults who perform the recommended physical activity each week is a major goal of Imagine Austin and is linked to other chronic diseases such as diabetes, obesity, and CVD.",,,,,56.5,,48.7,,49.7,,,percent
Prevalence of Obesity,"This indicator measures the prevalence of obesity among all Travis County adults. It is defined as respondents 18 years and older who have a BMI of 30 or greater, calculated by self-reported height and weight.","The chronic diseases associated with the risk factors of tobacco use, poor nutrition, and lack of physical activity (including some cancers, diabetes, heart disease, stroke, chronic obstructive pulmonary disease, and asthma) are the underlying causes of most deaths in Travis County.Reducing obesity is a major goal of Imagine Austin.",,,,,19.1,23.6,23.3,20.5,24,23.2,,percent
Prevalence of Cardiovascular Disease,"This indicator measures the prevalence of cardiovascular disease among Travis County adults. It is defined as respondents 18 years and older who were told by a health professional that they had a heart attack, angina/coronary heart disease or stroke. The chronic diseases associated with the risk factors of tobacco use, poor nutrition, and lack of physical activity (including some cancers, diabetes, heart disease, stroke, chronic obstructive pulmonary disease, and asthma) are the underlying causes of most deaths in Travis County.","Reducing the prevalence of CVD is a major goal of Imagine Austin. It is linked to other risk factors such as obesity, poor nutrition, tobacco use, and lack of physical activity.",,,,,5,4.9,1.5,4.4,4.9,6.2,,percent
Number of Affordable Residential Units Funded,This indicator measures the number of housing units built that receive all or part of their funding from federal or local government and cost less than 80% of median income for a family of four.,Rising housing costs have displaced many longtime residents and discouraged development in central Austin. Imagine Austin calls for the creation of more affordable housing throughout the city through partnerships and incentives to bring families back into the urban core.,,,,262,479,517,156,87,191,310,,housing units
