Indicator Name,Indicator Description,Importance and Relevance to Imagine Austin,2007,2008,2009,2010,2011,2012,2013,2014,2015,2016,2017,units
Percent of New Housing Units within the Growth Centers and Corridors,Percentage of new residential units issued permits in the Imagine Austin growth centers and corridors as compared to the rest of the City of Austin.,Imagine Austin calls for a majority of growth to occur in centers and corridors.,57.61,48.19,31.02,35.35,41.82,70.35,65.05,59.84,57.04,56.35,,percentage
Residential Water Consumption in Gallons per Capita per Day,"This indicator measures water consumption based on metered water volumes used by customers in the residential sector in Gallons Per Capita Per Day (GPCD) for single-family and multifamily water consumption only. The data are based on all single-family and multifamily retail customers according to billing records. This indicates our community's water use and efficiency on the household level, independent of growth in the business or industrial sectors.","The residential gallons per capita use indicator relates to the Sustainably Manage Our Water Resources (SMOWR) Priority Program in that a central focus of the program is on water resource management, water conservation, water reuse, and integrated water resource planning while balancing available resources, evolving technologies, growth trends, and environmental impacts. This indicator reflects residential use, independent of growth in business or industrial sectors. These efforts are reflected in the SMOWR Priority Program work goals including integrated water management, water conservation goals, and drought planning.",82,94,96,80,96,84,79,70,67,71,71,gallons
Intersection Density,"This indicator measures the number of street intersections per square mile. For this calculation, all intersections are weighted evenly, regardless of the number of connecting streets.",Imagine Austin calls for new development that is more walkable and less dependent upon automobile travel. Research shows that intersection density has the most influence on walkability and vehicle miles traveled (VMT).,34.3,34.8,35,35.1,35.3,34.8,35,35.3,35.4,35.5,,intersections per square mile
Prevalence of Diabetes,This indicator measures the prevalence of diabetes among all Travis County adults. It is defined as respondents 18 years and older who were told by a health professional that they have diabetes.,"The chronic diseases associated with the risk factors of tobacco use, poor nutrition, and lack of physical activity (including some cancers, diabetes, heart disease, stroke, chronic obstructive pulmonary disease, and asthma) are the underlying causes of most deaths in Travis County.Reducing diabetes is a major goal of Imagine Austin. It is linked to other risk factors such as obesity, poor nutrition, and lack of physical activity.",,,,,8,7.2,9.3,7.2,7.5,10.4,,percent
Median Family Income,"This indicator measures the median family income, which divides the income distribution into two equal parts: one-half of family households falling below the median income and one-half above the median.","Median family incomes have generally been outpaced by median housing prices, and are thus an indication of housing affordability and general prosperity. This indicator may not capture households who have left Austin for more affordable housing options outside of the city limits.",63116,64726,62153,61605,63672,68023,71511,76663,76629,86615,,USD
Homeless Count,This indicator measures the total number of persons who were identified and counted as homeless in the federally mandated Austin/Travis County Annual Point-in-Time Count. By its nature a count only includes persons who are homeless on the day of the count. Point-in-time counts tend to underestimate families and children and do not include individuals living in marginal situations.,"Homeless persons are often subjected to the elements, crime, and other maladies which often results in tragic consequences. Imagine Austin calls for reducing homelessness through supportive housing, mental health services/counseling, and alcohol/drug treatment.",,,1771,2087,2362,2244,2090,1987,1832,2138,2036,persons
Percent of Residents with Health Care Coverage,"This indicator measures the percent of Travis County residents with health care coverage defined as respondents 18 years to 64 years of age who report having any kind of health care coverage, including health insurance, prepaid plans such as HMOs, or government plans such as Medicaid or MAP. Adults over 64 years of age are automatically covered by Medicare and are not included.",Increasing access to health care is a major goal of Imagine Austin. Having health care is associated with improved management of chronic conditions and improved health outcomes.,,,,,,68.5,73.4,79.5,79.6,79.8,,percent
Development Within Edwards Aquifer Zones,"This indicator measures the total developed land area inside the City of Austin and its Extra Territorial Jurisdiction (ETJ) portion of the Edwards Aquifer Recharge and Contributing Zones. The aquifer is an underground layer of porous limestone rock that stores water. The contributing zone is where rainwater flows over land into creeks that “contribute” water to the aquifer downstream. The Recharge Zone contains karst limestone where water infiltrates and flows into karst caves, cracks, and other openings to directly fill or “recharge” the aquifer. There is little to no filtration of water pollutants in this recharge process, and it is therefore critical to reduce the level of intensity of development in these areas and use best management practices to capture, treat, and infiltrate stormwater runoff.","The Edwards Aquifer is perhaps the most important environmentally sensitive asset that provides drinking water and feeds a number of springs in Austin, including Barton Springs and its pool. Imagine Austin calls for directing growth away from the Barton Springs Zone of the Edwards Aquifer recharge and contributing zones and other water-supply watersheds.",,93.7,,99.4,,102.9,,105.9,,107.5,,square miles
Development within the 100 year Floodplain,This indicator measures the number of habitable buildings located in the 100-year floodplain. Floodplains are the areas likely to flood when our creeks rise and flow over their banks. Tracking development within the floodplain allows us to assess the risk to public safety. The 100-year floodplain is only suited for very limited development due to that risk. Numbers go down with City projects to remove or reduce risk to existing structures. Flood regulations prevent more structures from being introduced to the floodplain. Numbers can increase if areas with existing structures are annexed into the corporate city limits.,Imagine Austin calls for actions that reduce the threats flooding poses to public safety and private property.,,,,,,2380,,,,,1816,structures
Percent of New Non-Residential Development within Growth Centers and Corridors,Percentage of new non-residential issued permits in the Imagine Austin growth centers and corridors as compared to the rest of the City of Austin.,Imagine Austin calls for a majority of growth to occur in centers and corridors.,64.8,68.3,54.2,62.8,62.3,80.4,67.8,70.1,74.9,67.3,,percentage
Vehicle Miles Traveled per Capita,This indicator is an estimate of daily vehicle miles traveled on public roads divided by a population. Vehicle miles Traveled (VMT) is a composite measure based on traffic counts from more than one source.,"Reducing VMT is a major goal of Imagine Austin. Increased vehicle use means increased pollution, congestion, delay, and a general breakdown and overuse of our transportation infrastructure. It is a reflection of sprawl development, separation of home and work, and poorly designed infrastructure.",19.33,18.16,17.55,16.75,16.78,15.88,15.98,16.34,,,,miles
Median Housing Values,"This indicator measures the median housing value, which divides the value distribution into two equal parts: one-half of the cases falling below the median value of the property (house and lot, mobile home and lot, or condominium unit) and one-half above the median. The data include only units that are owned or on the market and reflect what the property would sell for if it were for sale.",Rising median home values have displaced many longtime residents and discouraged affordable development in central Austin. Imagine Austin calls for the creation of more affordable housing by way of partnerships and incentives to bring families back into the urban core.,195500,210600,214300,214500,217700,22100,234800,255900,282700,308500,,USD
Environmental Integrity Index of Stream Water Quality,"This indicator measure the percentage of watersheds having good or better Environmental Integrity Index (EII) scores. EII is a comprehensive set of water quality measurements which collectively assess watershed health. The EII is a program designed to regularly monitor and assess the chemical, biological, and physical integrity of Austin’s creeks and streams. The overall EII score is a comprehensive reflection of the health and resilience of Austin’s creeks. Austin creeks are now assessed every other year. It can be used to identify where problems occur and may be used to track the success of Austin’s water quality protection efforts over time.","Imagine Austin calls for actions that strengthen flood control, erosion, and water quality programs, incentives, regulations, and enforcement to incorporate best practices and meet or exceed national standards. EII monitoring collects the data essential to track present conditions and progress towards meeting these goals.",,40,,58,,49,,55,,75,,percent
"Participants in Arts, Culture, and Small Business Workshops Hosted by the City of Austin",This indicator measures the number of participants who attended workshops offered by the Economic Development Cultural Arts Division's Small Business Program as well as the Parks and Recreation Department.,"This indicator relates to the level of participation by the community to engage with and learn from City workshops geared toward professional development, education, and community networking designed to support the capacity, sustainability, and growth of the creative sector in Austin.",,,,,,186986,209630,366065,170391,325502,,participants
Amount of Permanently Preserved Land,"This indicator measures the combined acreage of the City of Austin owned or managed lands that are permanently protected from development. This includes the Balcones Canyonlands Preserve (BCP), the Water Quality Protection Lands (WQPL), and nature reserves managed by the Parks Department. These lands are typically set aside for species and water quality protection. The goal of the BCP is to protect and enhance the habitat of endangered and rare species as mitigation for land development, as well as manage these forest ecosystems to protect water, air, and scenic resources. The primary goal of the WQPL is to produce the optimal level of high quality water to recharge the Barton Springs segment of the Edwards Aquifer by managing protected land to restore prairie-savanna ecosystems and healthy riparian corridors. Nature preserves share these and other goals. (Note: Preservation lands owned or managed by county, state, or federal entities, are not included in these totals but further contribute to these regional goals.)","Imagine Austin calls for actions that direct development away from sensitive environmental resources, protect existing open space and natural resources, and improve air and water quality.",41001,41170,42647,42658,42690,42698,43383,44561,44587,44569,44575,acres
Prevalence of Tobacco Use,This indicator measures the prevalence of current tobacco use among all Travis County adults. It is defined as respondents 18 years and older who use smokeless tobacco every day or some days and/or are current smokers.,"The chronic diseases associated with the risk factors of tobacco use, poor nutrition, and lack of physical activity (including some cancers, diabetes, heart disease, stroke, chronic obstructive pulmonary disease, and asthma) are the underlying causes of most deaths in Travis County. Tobacco is one of the major causes of death in Travis County.Reducing tobacco use is a major goal of Imagine Austin.",,,,,17.4,15,15.3,12.2,16.6,16.7,,percent
Total Water Pumpage in Gallons per Capita per Day,This indicator measures the total water pumped from Austin Water treatment plants in Gallons Per Capita Per Day (GPCD). The total water pumpage per capita per day is how Austin Water tracks our community's progress relative to City Council's goal of reducing water use in Austin to 140 gallons per capita per day or lower by 2020.,"This indicator is a central focus of the SMOWR priority program and their work in water resource management, water conservation, water reuse, and integrated water resource planning while balancing available resources, evolving technologies, growth trends, and environmental impacts. These efforts are reflected in the SMOWR Priority Program work goals including integrated water management, water conservation goals, and drought planning.",151,170,167,137,162,142,136,125,122,122,126,gallons
Median Gross Rent,"This indicator measures the median gross rent, which divides the gross rent distribution into two equal parts: one-half of the cases falling below the median gross rent and one-half above the median. The data include only renter-occupied housing units paying cash rent.",A majority of Austinites rent and do not own their property. The tighter mortgage market means rental property will continue to play a large part in housing Austin’s residents. Rising rents have displaced many longtime residents and discouraged development in central Austin. Imagine Austin calls for the creation of more affordable housing by way of partnerships and incentives to bring families back into the urban core.,905,892,883,901,905,974,1008,1084,1139,1194,,USD
Bicycle Lane Miles,This indicator measure the total linear miles of bicycle lanes within the city limits.,"Bicycle lanes increase access and connectivity to jobs and services, and walking contributes to health, reduces emissions, and add to the quality of life in a community.",,117.6,133.9,146.3,165.6,189.5,207.1,236.4,246.2,321.5,338.2,linear miles
Percentage of Street Frontage with Sidewalks,This indicator measures the percent of street frontage with sidewalks by dividing the actual linear miles of sidewalks by the potential linear miles of sidewalk within the city limits of Austin.,"Sidewalks increase access and connectivity to jobs and services, and provide a number of benefits by improving walkability, which contributes to health, reduces emissions, and can add to the quality of life in a community.",,,,,,,43.6,,,48.2,53.1,percent
Small Business Growth,The yearly percentage change in the total number of employees working for businesses with fewer than employees.,Increasing small businesses and entrepreneurship is a major goal of Imagine Austin. Small businesses are a key component of Austin's economic vitality and resiliency.,,2.01,-2.94,2.69,4.95,5.32,4.61,5.82,3.6,,,percent
Residential Vacancy Rate,"This indicator measures the number of vacant or uninhabited housing units divided by the total number of units. Vacant units are excluded from the housing inventory if they are open to the elements, that is, the roof, walls, windows, and/or doors no longer protect the interior from the elements. Also excluded are vacant units with a sign that they are condemned or they are to be demolished.","Vacancy status has long been used as a basic indicator of the housing market and provides information on the stability and quality of housing for certain areas. The data is used to assess the demand for housing, to identify housing turnover within areas, and to better understand the population within the housing market over time. These data also serve to aid in the development of housing programs to meet the needs of persons at different economic levels.",8.03,8.36,8.37,8.93,7.97,8.23,6.99,7.95,8.23,8.16,,percent
"Property Crime Rate per 1,000 Population","This indicator measures the rate of property crime in the community. It is defined by the number of Part I violent and property crimes, as defined by the FBI UCR (uniform crime reporting) program, and includes burglary, theft, and auto theft. Crime rate is expressed as total offenses divided by Austin population/1,000.","Reducing crime is one of the goals of the comprehensive plan. Property crime in Austin has been higher than other major cities. The plan calls for improved collaboration between public safety providers and city planners to employ best development practices to reduce crime through urban design, density, mixed use development, and improved lighting, among others.",,,,,,52.19,48.5,41.42,37.71,35.09,34.24,rate
Percentage of Trips by Biking,This indicator measure the percentage of commuting trips made using a bicycle out of all means of transportation for workers age 16 and older.,"Imagine Austin calls for investment in compact and connected development, including bicycle and pedestrian infrastructure, and greater use of that infrastructure through alternative forms of transportation.",1,1.4,1.1,1.11,2.01,1.66,1.48,1.44,1.37,1.53,,percent
Residents Living within Walking Distance to Parks,This indicator measures the percent of residents living within ¼ mile walking distance of a park or accessible open space if inside the urban core or 1/2 mile walking distance of a park or accessible open space if outside of the urban core. Austin City Council policy calls for publicly-accessible and child-friendly parks and greenspace to be provided within ¼ mile and 1/2 mile walking distance of all residents inside and outside of the urban core respectively.,Imagine Austin calls for expanded and equitable access for active and passive parks throughout the city. This indicator also closely relates to the Imagine Austin vision of becoming a city of complete communities in which all Austinites have access to their daily needs within a short trip.,,,,,37,,,,,66.9,,percent
Developed Land Area,"This indicator tracks the change in developed land area in the City of Austin full and limited jurisdiction and Extraterritorial Jurisdiction (ETJ). ""Developed"" land is any land that has been improved, either with buildings or other functions, including new parkland and open space. Austin's urban, developed land area sprawled from 56 square miles to over 300 square miles between 1960 and 2010. Most of this development has not been compact, resulting in severe traffic, pollution, and costly and deteriorating infrastructure.","Imagine Austin calls for most new development to occur in growth centers, along corridors, and as infill development, while protecting agricultural, natural, and environmentally sensitive areas.",,322.4,,342.1,,353,,362.8,,372.1,,square miles
Percentage of Arterials with Bicycle Lanes,This indicator measure the percent of arterial street miles with bicycle lanes within the city limits.,"Bicycle lanes increase access and connectivity to jobs and services, and walking contributes to health, reduces emissions, and add to the quality of life in a community.",,,,,,,,34.4,35.4,37.6,37.9,percent
"Community and School Gardens per 1,000 People","This indicator measures the acreage of community and school gardens as a function of population. Community gardens are areas gardened collectively by a group of people. School gardens are included in the total garden acreage. Although school gardens do not serve the same purpose of community gardens, they are teaching future community gardeners, and have therefore been included.","Community gardens integrate nature into the city and allow for a space where people can gather to learn about local food production, healthy diets, and the natural sciences.",,,,,,0.021,0.032,0.033,0.036,0.051,0.053,"acres per 1,000 population"
Cost-Burdened Residential Units,"This indicator measures the percent of households where monthly rent (plus utility and/or housing fuel costs) or mortgage payments (or other housing debt costs) equal 30% or more of a household's monthly income. This metric provides a more complete picture of how affordable it is to live in Austin, since housing costs are but one of the components of the cost of living.",Rising costs of living paired with a slower wage growth has contributed to affordability issues in Austin. Imagine Austin calls for the creation of more affordable housing and to work to address household affordability with a holistic approach that address all of the various components that influence the cost of living.,38.64,37.87,38.85,42.37,39.98,39.22,38.15,37.34,36.12,34.64,,percent
Unemployment Rate,This indicator measures in part the prosperity of a community. The unemployment rate is the percentage of individuals ages 16 and older seeking work who are in the civilian labor force.,"Austin's typically low unemployment rate attracts investment and provides opportunity to residents. However, certain sectors of the population experience higher unemployment levels. Imagine Austin calls for continued investment in our workforce, education systems, entrepreneurs, and local businesses in order to sustain and grow Austin's economy.",3.5,4,6.3,6.2,5.8,5.1,4.6,3.7,3,3.1,2.9,percent
Annual Unlinked Transit Passenger Trips,This indicator tracks the total number of passenger boardings on all Capital Metro transit options.,Imagine Austin seeks to increase public transit ridership by expanding service to activity centers and increasing the efficiency of current system.,34039700,37399300,39438600,35859500,34740300,35512300,36402300,34178500,34700250,,,trips
Transportation System Total Annual Delay,This indicator represents the overall size of the congestion problem in Austin. It measures the cumulative travel time above that needed to complete a trip at free-flow speeds. The ranking of total delay usually follows the population ranking (larger regions usually have more delay).,,42462,42886,41227,43781,46010,48482,50055,51116,,,,thousands of person hours
Prevalence of Smoking,This indicator measures the prevalence of smoking among all Travis County adults. It is defined as respondents 18 years and older who have smoked 100 cigarettes in their lifetime and now smoke every day or some days.,Tobacco is a major cause of death in Travis County. And reducing tobacco use (and specifically smoking) is a major goal of Imagine Austin.,,,,,16.3,14.6,11.5,10.7,14.1,14.3,,percent
Tree Canopy Coverage,"This indicator measures the tree canopy coverage of Austin's full, limited, and extraterritorial jurisdictions. This is represented as the percentage of the total land area that is covered by tree foliage and is strongly correlated with the overall health of the urban environment. This indicator is measured using image analysis and GIS software and is subject to error at smaller scales.","Imagine Austin calls for actions that maintain and increase Austin’s urban forest as a key component of the green infrastructure network. Austin's urban forest provides social, ecological and economic benefits to the community and enhances the quality of life for Austin residents. City policies and practices aim to preserve, maintain, and replace individual trees and the urban forest as a whole.",,,,35,,,,36,,,,percent
"Violent Crime Rate per 1,000 Population","This indicator measures the rate of violent crime in the community. It is defined by the number of Part I violent and property crimes, as defined by the FBI UCR (uniform crime reporting) program, and includes murder, rape, robbery, and aggravated assault. The crime rate is expressed as total offenses divided by Austin population/1,000.","Reducing crime is one of the goals of the comprehensive plan. The plan calls for improved collaboration between public safety providers and city planners to employ best development practices to reduce crime through urban design, density, mixed use development, and improved lighting, and others strategies.",,,,,,4.09,3.63,3.96,3.73,4.08,4.26,rate
Ratio of Jobs to Households,"This indicator measures the jobs to housing balance. It is a ratio between the total job count in a jurisdiction and the total household count, i.e., occupied housing in the same area.","Imagine Austin notes a regional mismatch between the location of residences and jobs partly as a result of lifestyle preferences, but also rising housing costs throughout the region. Prospective homeowners must “drive until they qualify” to find affordable housing that meets their needs, and many of these affordable units are found in distant subdivisions with limited transportation options.",,,,1.56,,,,,,,,ratio
Number of Annual Cultural Contracts Applications,"Indicator relates to the financial investment offered to the creative community through the EDD Cultural Arts Division's Cultural Funding Programs, Cultural Tourism, and TEMPO temporary public art program.","This indicator relates to the level of community cultural activity taking place in Austin, supported by the City.",,,,,,244,275,257,401,478,,cultural funding applications
Overall Investment ($) in the Arts by the City of Austin,"This indicator measures the amount of funding from the City of Austin invest to provide support to arts activities and contracted arts services in Austin. This includes funding for the Cultural Arts Division of the Economic Development Department, Parks and Recreation Department's Arts and Culture Facilties, the Austin Bergstrom International Airport art, and MCP","Indicator relates to the financial investment offered to the creative community through the EDD Cultural Arts Division's Cultural Funding Programs, Cultural Tourism, and TEMPO temporary public art program.",,,,,,8472939,11329219,12715538,14908283,15352295,,USD
